{
  "contract_version": 1,
  "op": "lipsync_lse_c",
  "status": "OK",
  "outputs": {
    "value": 8.8,
    "evidence_uri": "/mnt/work/syncnet-f4/evidence_lipsync_lse_c.json"
  },
  "metrics": { "wall_ms": 1 },
  "operator_version": "syncnet_metric@0.1.0",
  "model_versions": { "model": "fake-sha@1" }
}
